<?xml version="1.0" encoding="UTF-8"?>

<p:app appname="Routing-App" package="org.accepto.app.routingapp"
	xmlns:p="org.accapto" xmlns:xsi="http://www.w3.org/2001/XMLSchema-instance"
	xsi:schemaLocation="org.accaptp accapto_model.xsd ">
	<p:profile>no restrictions</p:profile>
		

	<p:screen name="RoutingStart">
			<p:action function="getLocation" name="Location bestimmen" description=""/>
			<p:output description="RoutingStart" name="RoutingStart" type="text" />
			<p:input name="Ziel" description="geben Sie das Ziel ein" />
			<p:transition description="open Routing" name="Routing OverView" target="RoutingOverView" />
			<p:transition description="open settings" name="Settings" target="Setting" />	
	</p:screen>
	
	<p:screen name="RoutingOverView">
			<p:output description="RoutingOverView" name="RoutingOverView" type="text" />
			<p:output description="RoutingOverView ..." name="gehen sie ..." type="text" />
			<p:transition description="open Routing" name="RoutingDetails" target="RoutingDetail" />
			<p:input description="RoutingOverView ..." name="gehen sie ..." type="text" />
	</p:screen>
	
	<p:screen name="RoutingDetail">
			<p:output description="Einstellungen" name="Einstellungen" type="text" />
	</p:screen>
	
	
	<p:screen name="Setting">
			<p:output description="Setting" name="Setting" type="text" />
			<p:transition description="open main" name="A11y Settings " target="A12ySettingsActivity" />
	</p:screen>
	
	
	<p:screen description="" name="Start">
		<p:output description="" name="Routing App" type="text" />
		<p:transition description="open Routing" name="Routing" target="RoutingStart" />
		<p:transition description="open settings" name="Settings" target="Setting" />	
	</p:screen>
	
	
</p:app>
