<?xml version="1.0" encoding="UTF-8"?>

<p:app appname="RoutingappAAATE_upd51" package="org.accapto.routingapp"
xmlns:p="org.accapto" xmlns:xsi="http://www.w3.org/2001/XMLSchema-instance" xsi:schemaLocation="org.accaptp accapto_model.xsd">
<p:profile>normal</p:profile>


<p:screen name="RoutingTarget">
	<p:output name="Routing Target" description="enter a routing target" type="text" /> 
	<p:input name="search target" description="enter a routing target" /> 
	<p:action function="calculateRoute" name="calculate Route" description="calculate Route" /> 
	<p:transition description="shwo Route overview" name="route Overview" target="RoutingOverview" /> 
</p:screen>

<p:screen name="RoutingOverview">
	<p:output name="Routing Overview" description="Routing Overview" type="text" /> 
	<p:output name="Overview " description="description of the calucaled route" type="text" /> 
	<p:action function="startRouting" name="start routing" description="start Routing" /> 
	<p:transition description="new Route" name="select new routing target" target="RoutingTarget" /> 
</p:screen>

<p:screen name="RoutingDetails">
	<p:output name="Routing Details" description="Routing Details" type="text" /> 
	<p:output name="Direction" description="moving direction" type="text" /> 
	<p:output name="directionsymbol" description="moving direction" type="image" /> 
</p:screen>


<p:screen name="Settings">
	<p:output name="Settings" description="app settings" type="text" /> 
	
</p:screen>


<p:screen name="Start">
	
	<p:output name="ROUTING APP DEMO" description="demo app" type="text" /> 

	<p:transition name="Start " description="select routing target" target="RoutingTarget" /> 
	<p:transition name="Settings" description="modify app settings" target="Settings" /> 
</p:screen>

</p:app>